{
  "source": "llm-usage",
  "version": 1,
  "fetchedAt": "2026-10-26T08:00:00.000Z",
  "stale": false,
  "data": {
    "last7Days": {
      "costUsd": 41.37,
      "totalTokens": 16440000,
      "activeMs": 214464547
    },
    "monthToDate": {
      "costUsd": 152.8,
      "totalTokens": 61250000,
      "cacheSavingsUsd": 310.45,
      "activeMs": 517889547,
      "agents": [
        {
          "agent": "Claude Code",
          "costUsd": 98.1,
          "totalTokens": 39800000,
          "tokenShare": 0.6498
        },
        {
          "agent": "Codex",
          "costUsd": 41.2,
          "totalTokens": 15300000,
          "tokenShare": 0.2498
        },
        {
          "agent": "pi",
          "costUsd": 13.5,
          "totalTokens": 6150000,
          "tokenShare": 0.1004
        }
      ]
    },
    "streak": {
      "currentDays": 4,
      "longestDays": 23
    },
    "days": [
      {
        "date": "2026-10-12",
        "costUsd": 0,
        "totalTokens": 0,
        "activeMs": 0
      },
      {
        "date": "2026-10-13",
        "costUsd": 3.12,
        "totalTokens": 1250000,
        "activeMs": 15300000
      },
      {
        "date": "2026-10-14",
        "costUsd": 2.05,
        "totalTokens": 842000,
        "activeMs": 9000000
      },
      {
        "date": "2026-10-15",
        "costUsd": 0,
        "totalTokens": 0,
        "activeMs": 0
      },
      {
        "date": "2026-10-16",
        "costUsd": 6.4,
        "totalTokens": 2210500,
        "activeMs": 35100000
      },
      {
        "date": "2026-10-17",
        "costUsd": 4.18,
        "totalTokens": 1570000,
        "activeMs": 21725000
      },
      {
        "date": "2026-10-18",
        "costUsd": 0,
        "totalTokens": 0,
        "activeMs": 0
      },
      {
        "date": "2026-10-19",
        "costUsd": 0.21,
        "totalTokens": 95000,
        "activeMs": 900000
      },
      {
        "date": "2026-10-20",
        "costUsd": 8.77,
        "totalTokens": 3120000,
        "activeMs": 34932547
      },
      {
        "date": "2026-10-21",
        "costUsd": 5.02,
        "totalTokens": 1880000,
        "activeMs": 30240000
      },
      {
        "date": "2026-10-22",
        "costUsd": 0,
        "totalTokens": 0,
        "activeMs": 0
      },
      {
        "date": "2026-10-23",
        "costUsd": 1.6,
        "totalTokens": 640000,
        "activeMs": 70092000
      },
      {
        "date": "2026-10-24",
        "costUsd": 5.55,
        "totalTokens": 2040000,
        "activeMs": 40320000
      },
      {
        "date": "2026-10-25",
        "costUsd": 3.3,
        "totalTokens": 1310000,
        "activeMs": 27720000
      },
      {
        "date": "2026-10-26",
        "costUsd": 1.95,
        "totalTokens": 780000,
        "activeMs": 11160000
      }
    ]
  }
}
